<?xml version="1.0" encoding="UTF-8" standalone="no"?><!DOCTYPE metadata SYSTEM "metadata.dtd">
<metadata>
	<!--This is where we store information about the chunks-->
<storedChunk chunkID="1"><fileID>ea9376ad6bc69f34edc9678de6354c6146861c431f76aed3216f2022c134010a</fileID></storedChunk><storedChunk chunkID="1"><fileID>ea9376ad6bc69f34edc9678de6354c6146861c431f76aed3216f2022c134010a</fileID></storedChunk><storedChunk chunkID="1"><fileID>ea9376ad6bc69f34edc9678de6354c6146861c431f76aed3216f2022c134010a</fileID></storedChunk><storedChunk chunkID="1"><fileID>ea9376ad6bc69f34edc9678de6354c6146861c431f76aed3216f2022c134010a</fileID></storedChunk><storedChunk chunkID="1"><fileID>ea9376ad6bc69f34edc9678de6354c6146861c431f76aed3216f2022c134010a</fileID></storedChunk><storedChunk chunkID="1"><fileID>ea9376ad6bc69f34edc9678de6354c6146861c431f76aed3216f2022c134010a</fileID></storedChunk><storedChunk chunkID="1"><fileID>ea9376ad6bc69f34edc9678de6354c6146861c431f76aed3216f2022c134010a</fileID></storedChunk><storedChunk chunkID="1"><fileID>ea9376ad6bc69f34edc9678de6354c6146861c431f76aed3216f2022c134010a</fileID></storedChunk><storedChunk chunkID="1"><fileID>ea9376ad6bc69f34edc9678de6354c6146861c431f76aed3216f2022c134010a</fileID></storedChunk><storedChunk chunkID="1"><fileID>ea9376ad6bc69f34edc9678de6354c6146861c431f76aed3216f2022c134010a</fileID></storedChunk><storedChunk chunkID="1"><fileID>ea9376ad6bc69f34edc9678de6354c6146861c431f76aed3216f2022c134010a</fileID></storedChunk><storedChunk chunkID="1"><fileID>ea9376ad6bc69f34edc9678de6354c6146861c431f76aed3216f2022c134010a</fileID></storedChunk><storedChunk chunkID="1"><fileID>ea9376ad6bc69f34edc9678de6354c6146861c431f76aed3216f2022c134010a</fileID></storedChunk><storedChunk chunkID="1"><fileID>ea9376ad6bc69f34edc9678de6354c6146861c431f76aed3216f2022c134010a</fileID></storedChunk><storedChunk chunkID="1"><fileID>ea9376ad6bc69f34edc9678de6354c6146861c431f76aed3216f2022c134010a</fileID></storedChunk><storedChunk chunkID="1"><fileID>ea9376ad6bc69f34edc9678de6354c6146861c431f76aed3216f2022c134010a</fileID></storedChunk><storedChunk chunkID="1"><fileID>ea9376ad6bc69f34edc9678de6354c6146861c431f76aed3216f2022c134010a</fileID></storedChunk><storedChunk chunkID="1"><fileID>ea9376ad6bc69f34edc9678de6354c6146861c431f76aed3216f2022c134010a</fileID></storedChunk><storedChunk chunkID="1"><fileID>ea9376ad6bc69f34edc9678de6354c6146861c431f76aed3216f2022c134010a</fileID></storedChunk><storedChunk chunkID="1"><fileID>ea9376ad6bc69f34edc9678de6354c6146861c431f76aed3216f2022c134010a</fileID></storedChunk><storedChunk chunkID="1"><fileID>ea9376ad6bc69f34edc9678de6354c6146861c431f76aed3216f2022c134010a</fileID></storedChunk><storedChunk chunkID="1"><fileID>ea9376ad6bc69f34edc9678de6354c6146861c431f76aed3216f2022c134010a</fileID></storedChunk><storedChunk chunkID="1"><fileID>ea9376ad6bc69f34edc9678de6354c6146861c431f76aed3216f2022c134010a</fileID></storedChunk><storedChunk chunkID="1"><fileID>ea9376ad6bc69f34edc9678de6354c6146861c431f76aed3216f2022c134010a</fileID></storedChunk><storedChunk chunkID="1"><fileID>ea9376ad6bc69f34edc9678de6354c6146861c431f76aed3216f2022c134010a</fileID></storedChunk><storedChunk chunkID="1"><fileID>ea9376ad6bc69f34edc9678de6354c6146861c431f76aed3216f2022c134010a</fileID></storedChunk><storedChunk chunkID="1"><fileID>ea9376ad6bc69f34edc9678de6354c6146861c431f76aed3216f2022c134010a</fileID></storedChunk><storedChunk chunkID="1"><fileID>ea9376ad6bc69f34edc9678de6354c6146861c431f76aed3216f2022c134010a</fileID></storedChunk><storedChunk chunkID="1"><fileID>ea9376ad6bc69f34edc9678de6354c6146861c431f76aed3216f2022c134010a</fileID></storedChunk><storedChunk chunkID="1"><fileID>ea9376ad6bc69f34edc9678de6354c6146861c431f76aed3216f2022c134010a</fileID></storedChunk><storedChunk chunkID="1"><fileID>ea9376ad6bc69f34edc9678de6354c6146861c431f76aed3216f2022c134010a</fileID></storedChunk><storedChunk chunkID="1"><fileID>ea9376ad6bc69f34edc9678de6354c6146861c431f76aed3216f2022c134010a</fileID></storedChunk><storedChunk chunkID="1"><fileID>ea9376ad6bc69f34edc9678de6354c6146861c431f76aed3216f2022c134010a</fileID></storedChunk><storedChunk chunkID="1"><fileID>ea9376ad6bc69f34edc9678de6354c6146861c431f76aed3216f2022c134010a</fileID></storedChunk><storedChunk chunkID="1"><fileID>ea9376ad6bc69f34edc9678de6354c6146861c431f76aed3216f2022c134010a</fileID></storedChunk><storedChunk chunkID="1"><fileID>ea9376ad6bc69f34edc9678de6354c6146861c431f76aed3216f2022c134010a</fileID></storedChunk><storedChunk chunkID="1"><fileID>ea9376ad6bc69f34edc9678de6354c6146861c431f76aed3216f2022c134010a</fileID></storedChunk><storedChunk chunkID="1"><fileID>ea9376ad6bc69f34edc9678de6354c6146861c431f76aed3216f2022c134010a</fileID></storedChunk><storedChunk chunkID="1"><fileID>ea9376ad6bc69f34edc9678de6354c6146861c431f76aed3216f2022c134010a</fileID></storedChunk><storedChunk chunkID="1"><fileID>ea9376ad6bc69f34edc9678de6354c6146861c431f76aed3216f2022c134010a</fileID></storedChunk><storedChunk chunkID="1"><fileID>ea9376ad6bc69f34edc9678de6354c6146861c431f76aed3216f2022c134010a</fileID></storedChunk><storedChunk chunkID="1"><fileID>ea9376ad6bc69f34edc9678de6354c6146861c431f76aed3216f2022c134010a</fileID></storedChunk><storedChunk chunkID="1"><fileID>ea9376ad6bc69f34edc9678de6354c6146861c431f76aed3216f2022c134010a</fileID></storedChunk><storedChunk chunkID="1"><fileID>ea9376ad6bc69f34edc9678de6354c6146861c431f76aed3216f2022c134010a</fileID></storedChunk><storedChunk chunkID="1"><fileID>ea9376ad6bc69f34edc9678de6354c6146861c431f76aed3216f2022c134010a</fileID></storedChunk><storedChunk chunkID="1"><fileID>ea9376ad6bc69f34edc9678de6354c6146861c431f76aed3216f2022c134010a</fileID></storedChunk><storedChunk chunkID="1"><fileID>ea9376ad6bc69f34edc9678de6354c6146861c431f76aed3216f2022c134010a</fileID></storedChunk><storedChunk chunkID="1"><fileID>ea9376ad6bc69f34edc9678de6354c6146861c431f76aed3216f2022c134010a</fileID></storedChunk><storedChunk chunkID="1"><fileID>ea9376ad6bc69f34edc9678de6354c6146861c431f76aed3216f2022c134010a</fileID></storedChunk></metadata>